{
  "id": "veil_of_faith",
  "description": "Veil of Faith (shield on an ally): a warm dome of light forming - a gentle chord swell with a soft shimmer.",
  "category": "buff",
  "peak_dbfs": -6.0,
  "duration_s": 2.45,
  "layers": [
    {
      "type": "tone",
      "freqs": [
        [
          220,
          1
        ],
        [
          330,
          0.7
        ],
        [
          440,
          0.3
        ]
      ],
      "detune_cents": [
        -4,
        0,
        4
      ],
      "env": {
        "swell": [
          0.1,
          0.6
        ],
        "curve": 2.0
      },
      "gain": 0.7
    },
    {
      "type": "noise",
      "band": [
        3000,
        9000
      ],
      "env": {
        "swell": [
          0.15,
          0.4
        ],
        "curve": 2.0
      },
      "gain": 0.2
    },
    {
      "type": "tone",
      "freq": 55,
      "env": {
        "swell": [
          0.1,
          0.6
        ],
        "curve": 2.0
      },
      "gain": 0.7
    }
  ],
  "post": {
    "reverb": {
      "length_s": 1.2,
      "mix": 0.3,
      "brightness": 7000
    }
  }
}
