{
  "id": "foundry_gears",
  "description": "The casting wheel's gears start to bite: a deep iron groan, ratchet clicks speeding up, a hiss of steam and a low rumble under it (twist warning, M2-10).",
  "category": "impact",
  "peak_dbfs": -7.0,
  "processing": "impact_light",
  "duration_s": 3.0,
  "layers": [
    {
      "type": "resonant",
      "base": 95,
      "jitter": 0.04,
      "partials": [
        [
          1,
          3.5,
          1.0,
          0.45
        ],
        [
          2.3,
          4,
          0.55,
          0.35
        ],
        [
          3.7,
          5,
          0.3,
          0.25
        ]
      ],
      "glide": [
        1.12,
        2.2
      ],
      "scrape": [
        0.9,
        0.9
      ],
      "highpass": 60,
      "gain": 0.75
    },
    {
      "type": "resonant",
      "base": 1700,
      "jitter": 0.2,
      "partials": [
        [
          1,
          14,
          1.0,
          0.025
        ],
        [
          1.53,
          16,
          0.6,
          0.02
        ],
        [
          2.4,
          18,
          0.35,
          0.015
        ]
      ],
      "highpass": 900,
      "env": {
        "attack_s": 0.003,
        "decay_s": 0.03
      },
      "repeat": {
        "times": [
          0.35,
          0.8,
          1.15,
          1.45,
          1.7,
          1.9,
          2.07,
          2.22,
          2.35,
          2.47,
          2.58
        ],
        "gain_jitter": 0.3
      },
      "gain": 0.55
    },
    {
      "type": "noise",
      "band": [
        2500,
        9000
      ],
      "start_s": 0.8,
      "env": {
        "swell": [
          0.7,
          0.3
        ],
        "curve": 1.5
      },
      "gain": 0.18
    },
    {
      "type": "noise",
      "band": [
        40,
        220
      ],
      "env": {
        "attack_s": 0.4,
        "decay_s": 0.45
      },
      "am": [
        6,
        0.4
      ],
      "gain": 0.6
    },
    {
      "type": "noise",
      "band": [
        150,
        1200
      ],
      "env": {
        "swell": [
          0.5,
          0.45
        ],
        "curve": 1.2
      },
      "am": [
        17,
        0.5
      ],
      "gain": 0.45
    }
  ]
}
