{
  "id": "chains_of_awe_release",
  "description": "Chains of Awe cast: spectral chains flung out, a whoosh with rattling links.",
  "category": "release",
  "peak_dbfs": -5.0,
  "processing": "magic_release",
  "duration_s": 0.7,
  "layers": [
    {
      "type": "noise",
      "band": [
        600,
        2000
      ],
      "sweep_to": [
        1500,
        5000
      ],
      "steps": 6,
      "sweep_share": 0.5,
      "env": {
        "swell": [
          0.08,
          0.15
        ],
        "curve": 2.0
      },
      "gain": 0.8
    },
    {
      "type": "resonant",
      "base": 2000,
      "jitter": 0.18,
      "partials": [
        [
          1,
          18,
          0.9,
          0.03
        ],
        [
          1.73,
          22,
          0.7,
          0.024
        ],
        [
          2.61,
          25,
          0.5,
          0.0195
        ],
        [
          3.94,
          28,
          0.35,
          0.015
        ]
      ],
      "highpass": 1200,
      "gain": 0.5,
      "repeat": {
        "times": [
          0.05,
          0.1,
          0.16
        ],
        "jitter_s": 0.01,
        "gain_jitter": 0.5
      }
    }
  ],
  "post": {
    "reverb": {
      "length_s": 0.8,
      "mix": 0.2,
      "brightness": 7000
    }
  }
}
