{
  "id": "winged_stride",
  "description": "Winged Stride (speed buff): a quick flutter of wings and an upward whoosh.",
  "category": "buff",
  "peak_dbfs": -6.0,
  "duration_s": 1.5,
  "layers": [
    {
      "type": "noise",
      "band": [
        400,
        2500
      ],
      "am": [
        11,
        0.9
      ],
      "env": {
        "swell": [
          0.1,
          0.35
        ],
        "curve": 2.0
      },
      "gain": 1.0
    },
    {
      "type": "noise",
      "band": [
        800,
        2500
      ],
      "sweep_to": [
        2500,
        8000
      ],
      "steps": 6,
      "env": {
        "swell": [
          0.15,
          0.15
        ],
        "curve": 2.0
      },
      "gain": 0.5
    }
  ],
  "post": {
    "reverb": {
      "length_s": 0.7,
      "mix": 0.2,
      "brightness": 7000
    }
  }
}
