{
  "id": "swing_mace",
  "description": "Mace swing: a short, dense, low whoosh.",
  "category": "swing",
  "peak_dbfs": -7.0,
  "variants": 3,
  "duration_s": 0.4,
  "layers": [
    {
      "type": "noise",
      "band": [
        250,
        800
      ],
      "sweep_to": [
        600,
        1800
      ],
      "steps": 8,
      "sweep_share": 0.5,
      "env": {
        "swell": [
          0.13,
          0.05
        ],
        "curve": 2.5
      },
      "gain": 1.0
    },
    {
      "type": "noise",
      "lowpass": 300,
      "env": {
        "swell": [
          0.13,
          0.05
        ],
        "curve": 2.5
      },
      "gain": 0.5
    }
  ],
  "post": {
    "reverb": {
      "length_s": 0.35,
      "mix": 0.1,
      "brightness": 3500
    }
  }
}
