{
  "id": "shiver_lance_impact",
  "description": "Shiver Lance pierces: sharp ice tip, a tight thunk, small shards.",
  "category": "impact",
  "peak_dbfs": -4.0,
  "processing": "impact_light",
  "duration_s": 0.5,
  "layers": [
    {
      "type": "noise",
      "highpass": 3000,
      "env": {
        "attack_s": 0.0002,
        "decay_s": 0.003
      },
      "gain": 1.1
    },
    {
      "type": "resonant",
      "base": 3800,
      "jitter": 0.1,
      "partials": [
        [
          1,
          20,
          0.8,
          0.035
        ],
        [
          1.41,
          22,
          0.6,
          0.028000000000000004
        ],
        [
          2.13,
          24,
          0.5,
          0.022750000000000003
        ],
        [
          2.97,
          26,
          0.4,
          0.0175
        ]
      ],
      "highpass": 2500,
      "gain": 0.6
    },
    {
      "type": "noise",
      "lowpass": 450,
      "env": {
        "attack_s": 0.0008,
        "decay_s": 0.03
      },
      "gain": 1.3
    },
    {
      "type": "crackle",
      "band": [
        1500,
        6000
      ],
      "per_second": 900,
      "grain_s": 0.002,
      "env": {
        "attack_s": 0.001,
        "decay_s": 0.05
      },
      "gain": 0.5
    }
  ],
  "post": {
    "saturate": 1.6,
    "reverb": {
      "length_s": 0.4,
      "mix": 0.1,
      "brightness": 6000
    }
  }
}
