{
  "id": "heal_chorus",
  "description": "Chorus of Mending lands: a swelling choir over a deep chord, with high bells.",
  "category": "heal",
  "peak_dbfs": -5.0,
  "duration_s": 2.8,
  "layers": [
    {
      "type": "saw",
      "freq": 110,
      "vibrato": [
        5,
        0.004
      ],
      "formants": [
        [
          700,
          8,
          1.0
        ],
        [
          1150,
          9,
          0.5
        ],
        [
          2700,
          10,
          0.2
        ]
      ],
      "env": {
        "swell": [
          0.08,
          0.5
        ],
        "curve": 2.0
      },
      "gain": 0.5
    },
    {
      "type": "tone",
      "freqs": [
        [
          55,
          1
        ],
        [
          110,
          0.7
        ],
        [
          164.8,
          0.5
        ]
      ],
      "detune_cents": [
        -4,
        0,
        4
      ],
      "env": {
        "swell": [
          0.05,
          0.7
        ],
        "curve": 2.0
      },
      "gain": 1.0
    },
    {
      "type": "tone",
      "freqs": [
        [
          659.3,
          1
        ],
        [
          880,
          0.6
        ]
      ],
      "harmonics": [
        [
          1,
          1
        ],
        [
          2.76,
          0.12
        ]
      ],
      "env": {
        "attack_s": 0.004,
        "decay_s": 0.4
      },
      "gain": 0.2
    }
  ],
  "post": {
    "saturate": 1.2,
    "reverb": {
      "length_s": 1.3,
      "mix": 0.28,
      "brightness": 6000
    }
  }
}
