{
  "id": "dispel_frost",
  "description": "Unravel (frost dispel) cast: a cold sweep downward with a crackle.",
  "category": "release",
  "peak_dbfs": -6.0,
  "duration_s": 0.85,
  "layers": [
    {
      "type": "noise",
      "band": [
        4000,
        10000
      ],
      "sweep_to": [
        1000,
        3000
      ],
      "steps": 8,
      "sweep_share": 0.6,
      "env": {
        "swell": [
          0.05,
          0.2
        ],
        "curve": 2.0
      },
      "gain": 1.0
    },
    {
      "type": "crackle",
      "band": [
        2000,
        8000
      ],
      "per_second": 700,
      "grain_s": 0.002,
      "env": {
        "attack_s": 0.001,
        "decay_s": 0.15
      },
      "gain": 0.5
    }
  ],
  "post": {
    "reverb": {
      "length_s": 0.6,
      "mix": 0.2,
      "brightness": 8000
    }
  }
}
