{
  "id": "foundry_wheel",
  "description": "The casting wheel lurches into motion: a huge iron clunk, chains snapping taut and rattling, and a grinding rumble as the crucibles start to roll (twist, M2-10).",
  "category": "impact",
  "peak_dbfs": -2.0,
  "processing": "impact_low",
  "duration_s": 3.0,
  "layers": [
    {
      "type": "sub",
      "from_hz": 90,
      "to_hz": 38,
      "curve": 6,
      "env": {
        "attack_s": 0.003,
        "decay_s": 0.35
      },
      "gain": 1.0
    },
    {
      "type": "resonant",
      "base": 210,
      "jitter": 0.05,
      "partials": [
        [
          1,
          4,
          1.0,
          0.4
        ],
        [
          2.76,
          5,
          0.6,
          0.3
        ],
        [
          5.4,
          6,
          0.35,
          0.2
        ]
      ],
      "highpass": 120,
      "gain": 0.7
    },
    {
      "type": "noise",
      "band": [
        200,
        3000
      ],
      "env": {
        "attack_s": 0.001,
        "decay_s": 0.06
      },
      "gain": 0.8
    },
    {
      "type": "crackle",
      "band": [
        1500,
        7000
      ],
      "per_second": 60,
      "grain_s": 0.012,
      "start_s": 0.15,
      "env": {
        "attack_s": 0.05,
        "decay_s": 0.5
      },
      "gain": 0.45
    },
    {
      "type": "resonant",
      "base": 2600,
      "jitter": 0.3,
      "partials": [
        [
          1,
          16,
          1.0,
          0.03
        ],
        [
          1.41,
          18,
          0.5,
          0.02
        ]
      ],
      "highpass": 1500,
      "env": {
        "attack_s": 0.003,
        "decay_s": 0.035
      },
      "repeat": {
        "count": 14,
        "every_s": 0.09,
        "jitter_s": 0.04,
        "gain_jitter": 0.6
      },
      "start_s": 0.2,
      "gain": 0.35
    },
    {
      "type": "noise",
      "band": [
        60,
        600
      ],
      "start_s": 0.3,
      "env": {
        "swell": [
          0.5,
          0.45
        ],
        "curve": 1.3
      },
      "am": [
        4,
        0.15
      ],
      "gain": 0.6
    }
  ]
}
