{
  "id": "heal_hot_apply",
  "description": "Lingering Grace applied: a gentle low glow with a soft shimmer.",
  "category": "heal",
  "peak_dbfs": -8.0,
  "duration_s": 1.6,
  "layers": [
    {
      "type": "tone",
      "freqs": [
        [
          55,
          1
        ],
        [
          110,
          0.6
        ],
        [
          164.8,
          0.4
        ]
      ],
      "env": {
        "swell": [
          0.05,
          0.4
        ],
        "curve": 2.0
      },
      "gain": 1.0
    },
    {
      "type": "noise",
      "band": [
        3000,
        8000
      ],
      "env": {
        "swell": [
          0.1,
          0.3
        ],
        "curve": 2.0
      },
      "gain": 0.15
    }
  ],
  "post": {
    "reverb": {
      "length_s": 1.0,
      "mix": 0.25,
      "brightness": 6000
    }
  }
}
