{
  "id": "heal_hot_tick",
  "description": "Lingering Grace ticks: a very soft warm pulse.",
  "category": "heal",
  "peak_dbfs": -14.0,
  "duration_s": 1.0,
  "layers": [
    {
      "type": "tone",
      "freqs": [
        [
          55,
          1
        ],
        [
          110,
          0.6
        ]
      ],
      "env": {
        "attack_s": 0.02,
        "decay_s": 0.25
      },
      "gain": 1.0
    },
    {
      "type": "noise",
      "band": [
        3000,
        8000
      ],
      "env": {
        "swell": [
          0.03,
          0.15
        ],
        "curve": 2.0
      },
      "gain": 0.1
    }
  ],
  "post": {
    "reverb": {
      "length_s": 0.6,
      "mix": 0.2,
      "brightness": 6000
    }
  }
}
