{
  "id": "sanctum",
  "description": "Sanctum: a bright bell strike, then a shimmering major chord that swells and holds over a low hum (full immunity, distinct from Veil of Faith's softer minor chord).",
  "category": "buff",
  "peak_dbfs": -5.0,
  "duration_s": 3.2,
  "layers": [
    {
      "type": "tone",
      "freqs": [
        [
          523.3,
          1
        ],
        [
          659.3,
          0.75
        ],
        [
          784.0,
          0.6
        ],
        [
          1046.5,
          0.3
        ]
      ],
      "harmonics": [
        [
          1,
          1
        ],
        [
          2.76,
          0.18
        ],
        [
          5.4,
          0.06
        ]
      ],
      "env": {
        "attack_s": 0.002,
        "decay_s": 0.7
      },
      "gain": 0.55
    },
    {
      "type": "tone",
      "freqs": [
        [
          261.6,
          1
        ],
        [
          329.6,
          0.8
        ],
        [
          392.0,
          0.7
        ]
      ],
      "detune_cents": [
        -5,
        0,
        5
      ],
      "env": {
        "swell": [
          0.3,
          0.6
        ],
        "curve": 2.0
      },
      "gain": 0.6
    },
    {
      "type": "noise",
      "band": [
        4000,
        11000
      ],
      "env": {
        "swell": [
          0.3,
          0.5
        ],
        "curve": 2.0
      },
      "am": [
        7,
        0.4
      ],
      "gain": 0.16
    },
    {
      "type": "tone",
      "freq": 65.4,
      "env": {
        "swell": [
          0.2,
          0.7
        ],
        "curve": 2.0
      },
      "gain": 0.7
    }
  ]
}
