{
  "id": "shield_breaker_release",
  "description": "Shield Breaker thrown: a spinning, whirring blade.",
  "category": "release",
  "peak_dbfs": -6.0,
  "duration_s": 0.9,
  "layers": [
    {
      "type": "noise",
      "band": [
        500,
        1500
      ],
      "sweep_to": [
        1500,
        4000
      ],
      "steps": 8,
      "am": [
        14,
        0.7
      ],
      "env": {
        "swell": [
          0.1,
          0.2
        ],
        "curve": 2.0
      },
      "gain": 1.0
    }
  ],
  "post": {
    "reverb": {
      "length_s": 0.5,
      "mix": 0.15,
      "brightness": 5000
    }
  }
}
