{
  "id": "heal_release",
  "description": "A heal spell released: a soft chime and a breath of air.",
  "category": "release",
  "peak_dbfs": -7.0,
  "duration_s": 1.55,
  "layers": [
    {
      "type": "tone",
      "freqs": [
        [
          330,
          1
        ],
        [
          415.3,
          0.6
        ],
        [
          493.9,
          0.5
        ]
      ],
      "harmonics": [
        [
          1,
          1
        ],
        [
          2.76,
          0.15
        ]
      ],
      "env": {
        "attack_s": 0.005,
        "decay_s": 0.4
      },
      "gain": 0.6
    },
    {
      "type": "noise",
      "band": [
        2000,
        7000
      ],
      "env": {
        "swell": [
          0.02,
          0.2
        ],
        "curve": 2.0
      },
      "gain": 0.3
    },
    {
      "type": "tone",
      "freq": 55,
      "env": {
        "attack_s": 0.01,
        "decay_s": 0.3
      },
      "gain": 0.5
    }
  ],
  "post": {
    "reverb": {
      "length_s": 1.0,
      "mix": 0.25,
      "brightness": 7000
    }
  }
}
